{
  "contractVersion": "schema-versioning@0.1.0",
  "schemaId": "draft-import",
  "owningPackage": "@narrative-engine/validation",
  "contract": {
    "id": "draft-import",
    "version": "draft-import@0.1.0"
  },
  "versions": [
    {
      "schemaVersion": 1,
      "status": "accepted",
      "jsonSchema": "schemas/draft-import.v1.schema.json"
    },
    {
      "schemaVersion": 2,
      "status": "accepted",
      "jsonSchema": "schemas/draft-import.schema.json"
    }
  ],
  "readerSupport": {
    "minVersion": 1,
    "maxVersion": 2
  },
  "writerVersion": 2,
  "migrations": [
    {
      "migrationId": "draft-import.1-to-2",
      "schemaId": "draft-import",
      "fromVersion": 1,
      "toVersion": 2,
      "direction": "upgrade",
      "deterministic": true,
      "lossy": true,
      "lossDescription": "Drops editor-only scratch notes that are not part of canonical data.",
      "requiresContext": false
    }
  ]
}
